Rank,TOP500 Rank,Name,Computer,Site,Manufacturer,Country,Year,Segment,Total Cores,Accelerator/Co-Processor Cores,Rmax [TFlop/s],Rpeak [TFlop/s],Power (kW),Power Source,Power Effeciency [GFlops/Watts],Power Source,Power Quality Level,Measured Cores,Optimized Run (HPL),Optimized Run (Peak Power),Architecture,Processor,Processor Technology,Processor Speed (MHz),Operating System,OS Family,Accelerator/Co-Processor,Cores per Socket,Processor Generation,System Model,System Family,Interconnect Family,Interconnect,Region,Continent,Site ID,System ID
1,259,Shoubu system B,"ZettaScaler-2.2, Xeon D-1571 16C 1.3GHz, Infiniband EDR, PEZY-SC2","Advanced Center for Computing and Communication, RIKEN",PEZY Computing / Exascaler Inc.,Japan,2016,Research,794400,793600,841.96,1127.68,49.5,Submitted,17.009,,1,272,,,Cluster,Xeon D-1571 16C 1.3GHz,Intel Broadwell,1300,CentOS,Linux,PEZY-SC2 500Mhz,16,Intel Xeon E5 (Broadwell),ZettaScaler-2.2,Pezy/Exascaler Cluster,Infiniband,Infiniband EDR,Eastern Asia,Asia,50577,179165
2,307,Suiren2,"ZettaScaler-2.2, Xeon D-1571 16C 1.3GHz, Infiniband EDR, PEZY-SC2",High Energy Accelerator Research Organization /KEK,PEZY Computing / Exascaler Inc.,Japan,2017,Research,762624,761856,788.1963,1082.573,47.03,Submitted,16.759,,1,768,,,Cluster,Xeon D-1571 16C 1.3GHz,Intel Broadwell,1300,CentOS,Linux,PEZY-SC2 500Mhz,16,Intel Xeon E5 (Broadwell),ZettaScaler-2.2,Pezy/Exascaler Cluster,Infiniband,Infiniband EDR,Eastern Asia,Asia,47988,179164
3,276,Sakura,"ZettaScaler-2.2, Xeon E5-2618Lv3  8C 2.3GHz, Infiniband EDR, PEZY-SC2",PEZY Computing K.K.,PEZY Computing / Exascaler Inc.,Japan,2016,Industry,794400,793600,824.6961,1127.68,49.51,Submitted,16.657,,1,800,,,Cluster,Xeon E5-2618Lv3  8C 2.3GHz,Intel Haswell,2300,CentOS,Linux,PEZY-SC2 500Mhz,8,Intel Xeon E5 (Haswell),ZettaScaler-2.2,Pezy/Exascaler Cluster,Infiniband,Infiniband EDR,Eastern Asia,Asia,50638,178807
4,149,DGX SaturnV Volta,"NVIDIA DGX-1 Volta36, Xeon E5-2698v4 20C 2.2GHz, Infiniband EDR, NVIDIA Tesla V100",NVIDIA Corporation,Nvidia,United States,2017,Industry,22440,21120,1070,1819.752,97,Optimized,15.113,Optimized,2,1320,937,62,Cluster,Xeon E5-2698v4 20C 2.2GHz,Intel Broadwell,2200,Ubuntu Linux,Linux,NVIDIA Tesla V100,20,Intel Xeon E5 (Broadwell),NVIDIA DGX-1 Volta36,NVIDIA DGX,Infiniband,Infiniband EDR,North America,Americas,48448,179166
5,4,Gyoukou,"ZettaScaler-2.2 HPC system, Xeon D-1571 16C 1.3GHz, Infiniband EDR, PEZY-SC2 700Mhz",Japan Agency for Marine-Earth Science and Technology,ExaScaler,Japan,2017,Research,19860000,19840000,19135.8,28192,1350.2,Submitted,14.173,,1,2462640,,,Cluster,Xeon D-1571 16C 1.3GHz,Intel Broadwell,1300,CentOS,Linux,PEZY-SC2 700Mhz,16,Intel Xeon E5 (Broadwell),ZettaScaler-2.2 HPC system,ZettaScaler,Infiniband,Infiniband EDR,Eastern Asia,Asia,49318,179102
6,13,TSUBAME3.0,"SGI ICE XA, IP139-SXM2, Xeon E5-2680v4 14C 2.4GHz, Intel Omni-Path, NVIDIA Tesla P100 SXM2","GSIC Center, Tokyo Institute of Technology",HPE,Japan,2017,Academic,135828,120736,8125,12127.069,792.08,Optimized,13.704,Optimized,1,135828,7027,512.77,Cluster,Xeon E5-2680v4 14C 2.4GHz,Intel Broadwell,2400,SUSE Linux Enterprise Server 12 SP1,Linux,NVIDIA Tesla P100 NVLink,14,Intel Xeon E5 (Broadwell),"SGI ICE XA (HPE SGI 8600), IP139-SXM2",HPE SGI 8600,Omnipath,Intel Omni-Path,Eastern Asia,Asia,47912,179093
7,195,AIST AI Cloud,"NEC 4U-8GPU Server, Xeon E5-2630Lv4 10C 1.8GHz, Infiniband EDR, NVIDIA Tesla P100 SXM2",National Institute of Advanced Industrial Science and Technology,NEC,Japan,2017,Research,23400,22400,961,2148.8,75.78,Submitted,12.681,,1,23400,,,Cluster,Xeon E5-2630Lv4 10C 1.8GHz,Intel Broadwell,1800,CentOS,Linux,NVIDIA Tesla P100 NVLink,10,Intel Xeon E5 (Broadwell),NEC 4U-8GPU Server,NEC Cluster,Infiniband,Infiniband EDR,Eastern Asia,Asia,50718,179091
8,419,RAIDEN GPU subsystem,"NVIDIA DGX-1, Xeon E5-2698v4 20C 2.2GHz, Infiniband EDR, NVIDIA Tesla P100","Center for Advanced Intelligence Project, RIKEN",Fujitsu,Japan,2017,Research,11712,10752,635.1,947.712,59.9,Submitted,10.603,,1,600,,,Cluster,Xeon E5-2698v4 20C 2.2GHz,Intel Broadwell,2200,Ubuntu 14.04,Linux,NVIDIA Tesla P100,20,Intel Xeon E5 (Broadwell),NVIDIA DGX-1,NVIDIA DGX,Infiniband,Infiniband EDR,Eastern Asia,Asia,50716,179088
9,115,Wilkes-2,"Dell C4130, Xeon E5-2650v4 12C 2.2GHz, Infiniband EDR, NVIDIA Tesla P100",University of Cambridge,Dell EMC,United Kingdom,2017,Academic,21240,20160,1193,1751.616,114.4,Submitted,10.428,,,20768,,,Cluster,Xeon E5-2650v4 12C 2.2GHz,Intel Broadwell,2200,Scientific Linux,Linux,NVIDIA Tesla P100,12,Intel Xeon E5 (Broadwell),Dell C4130,Dell PowerEdge Cluster,Infiniband,Infiniband EDR,Northern Europe,Europe,49143,179044
10,3,Piz Daint,"Cray XC50, Xeon E5-2690v3 12C 2.6GHz, Aries interconnect , NVIDIA Tesla P100",Swiss National Supercomputing Centre (CSCS),Cray Inc.,Switzerland,2017,Research,361760,297920,19590,25326.264,2271.99,Optimized,10.398,Optimized,3,361760,16960,1631.13,MPP,Xeon E5-2690v3 12C 2.6GHz,Intel Haswell,2600,Cray Linux Environment ,Linux,NVIDIA Tesla P100,12,Intel Xeon E5 (Haswell),Cray XC50,Cray XC,Custom Interconnect,Aries interconnect ,Western Europe,Europe,50422,177824
11,291,Reedbush-L,"SGI Rackable C1102-GP8, Xeon E5-2695v4 18C 2.1GHz, Infiniband EDR, NVIDIA Tesla P100 NVLink","Information Technology Center, The University of Tokyo",HPE,Japan,2017,Academic,16640,14336,805.6,1434.214,79.24,Submitted,10.167,,3,16640,,,Cluster,Xeon E5-2695v4 18C 2.1GHz,Intel Broadwell,2100,RHEL 7.3,Linux,NVIDIA Tesla P100 NVLink,18,Intel Xeon E5 (Broadwell),SGI Rackable C1102-GP8,Rackable Cluster,Infiniband,Infiniband EDR,Eastern Asia,Asia,50096,179171
12,319,Research Computation Facility for GOSAT-2 (RCF2),"SGI Rackable C1104-GP1, Xeon E5-2650v4 12C 2.2GHz, Infiniband EDR, NVIDIA Tesla P100",National Institute for Environmental Studies,NSSOL/HPE,Japan,2017,Research,16320,13440,770.4,1243.776,78.64,Submitted,9.797,,,,,,Cluster,Xeon E5-2650v4 12C 2.2GHz,Intel Broadwell,2200,CentOS,Linux,NVIDIA Tesla P100,12,Intel Xeon E5 (Broadwell),SGI Rackable C1104-GP1,Rackable Cluster,Infiniband,Infiniband EDR,Eastern Asia,Asia,48474,179108
13,35,,"NVIDIA DGX-1/Relion 2904GT, Xeon E5-2698v4 20C 2.2GHz/ E5-2650v4, Infiniband EDR, NVIDIA Tesla P100/Quadro GP100",Facebook,Self-made,United States,2017,Industry,60512,55552,3307,4896.512,349.5,Submitted,9.462,,2,4960,,,Cluster,Xeon E5-2698v4 20C 2.2GHz,Intel Broadwell,2200,Ubuntu Linux,Linux,NVIDIA Tesla P100,20,Intel Xeon E5 (Broadwell),NVIDIA DGX-1/Relion 2904GT,Hybrid Cluster,Infiniband,Infiniband EDR,North America,Americas,50701,179068
14,36,DGX Saturn V,"NVIDIA DGX-1, Xeon E5-2698v4 20C 2.2GHz, Infiniband EDR, NVIDIA Tesla P100",NVIDIA Corporation,Nvidia,United States,2016,Industry,60512,55552,3307,4896.512,349.5,Submitted,9.462,,,,,,Cluster,Xeon E5-2698v4 20C 2.2GHz,Intel Broadwell,2200,Ubuntu 14.04,Linux,NVIDIA Tesla P100,20,Intel Xeon E5 (Broadwell),NVIDIA DGX-1,NVIDIA DGX,Infiniband,Infiniband EDR,North America,Americas,48448,178928
15,109,Era-AI,"Sugon Cluster W780I, Xeon E5-2650v4 12C 2.2GHz, NVIDIA Tesla P100, Infiniband FDR","Computer Network Information Center, Chinese Academy of Science",Sugon,China,2017,Academic,22656,21504,1238,1845.3504,144,Submitted,8.597,,,22656,,,Cluster,Xeon E5-2650v4 12C 2.2GHz,Intel Broadwell,2200,CentOS,Linux,NVIDIA Tesla P100,12,Intel Xeon E5 (Broadwell),Sugon Cluster W780I,Sugon Cluster,Infiniband,Infiniband FDR,Eastern Asia,Asia,47553,179247
16,295,Reedbush-H,"SGI Rackable C1102-GP8, Xeon E5-2695v4 18C 2.1GHz, Infiniband FDR, NVIDIA Tesla P100 SXM2","Information Technology Center, The University of Tokyo",HPE,Japan,2017,Academic,17760,13440,802.4,1417.152,93.57,Submitted,8.575,,,,,,Cluster,Xeon E5-2695v4 18C 2.1GHz,Intel Broadwell,2100,RHEL 7.3,Linux,NVIDIA Tesla P100 NVLink,18,Intel Xeon E5 (Broadwell),SGI Rackable C1102-GP8,Rackable Cluster,Infiniband,Infiniband FDR,Eastern Asia,Asia,50096,179107
17,94,Cedar,"Dell C4130/Dell C6320, Xeon E5-2650v4/E5-2683-v4, Intel Omni-Path, NVIDIA Tesla P100",Simon Fraser University/Compute Canada,Dell EMC,Canada,2017,Academic,59776,32256,1337,3710.464,167,Submitted,8.006,,1,3456,,,Cluster,Xeon E5-2650v4 12C 2.2GHz,Intel Broadwell,2200,CentOS,Linux,NVIDIA Tesla P100,12,Intel Xeon E5 (Broadwell),Dell C4130,Dell PowerEdge Cluster,Omnipath,Intel Omni-Path,North America,Americas,50722,179113
18,440,DAVIDE,"E4 OP206 cluster, IBM Power8+ 8C 3.26GHz, Infiniband EDR, NVIDIA Tesla P100 SXM2",E4 Computer Engineering,E4 Computer Engineering S.p.A.,Italy,2017,Industry,10560,9856,615.4,951.15469,78.29,Submitted,7.861,,1,704,,,Cluster,IBM Power8+ 8C 3.26GHz,Power,3259,CentOS,Linux,NVIDIA Tesla P100 NVLink,8,IBM Power8+,E4 OP206 cluster,E4 cluster,Infiniband,Infiniband EDR,Southern Europe,Europe,50720,179104
19,180,Shoubu,"ZettaScaler-1.6, Xeon E5-2618Lv3  8C 2.3GHz, Infiniband FDR, PEZY-SCnp","Advanced Center for Computing and Communication, RIKEN",PEZY Computing / Exascaler Inc.,Japan,2015,Research,1313280,1310720,1001.01,1533.46048,149.99,Submitted,6.674,,1,,,,Cluster,Xeon E5-2618Lv3  8C 2.3GHz,Intel Haswell,2300,Linux,Linux,PEZY-SCnp,8,Intel Xeon E5 (Haswell),ZettaScaler-1.6,Pezy/Exascaler Cluster,Infiniband,Infiniband FDR,Eastern Asia,Asia,50577,178809
20,1,Sunway TaihuLight,"Sunway MPP, Sunway SW26010 260C 1.45GHz, Sunway",National Supercomputing Center in Wuxi,NRCPC,China,2016,Research,10649600,,93014.59388,125435.904,15371,Submitted,6.051,,2,,,,MPP,Sunway SW26010 260C 1.45GHz,ShenWei,1450,Sunway RaiseOS 2.0.5,Linux,None,260,Sunway,Sunway MPP,Sunway Cluster,Custom Interconnect,Sunway,Eastern Asia,Asia,50623,178764
21,18,Theta,"Cray XC40, Intel Xeon Phi 7230 64C 1.3GHz, Aries interconnect ",DOE/SC/Argonne National Laboratory,Cray Inc.,United States,2017,Research,231424,,5884.62,9627.238,1087,Submitted,5.414,,,,,,MPP,Intel Xeon Phi 7230 64C 1.3GHz,Intel Xeon Phi,1300,Cray Linux Environment ,Linux,None,64,Intel Xeon Phi,Cray XC40,Cray XC,Custom Interconnect,Aries interconnect ,North America,Americas,47347,178926
22,9,Oakforest-PACS,"PRIMERGY CX1640 M1, Intel Xeon Phi 7250 68C 1.4GHz, Intel Omni-Path",Joint Center for Advanced High Performance Computing,Fujitsu,Japan,2016,Academic,556104,,13554.6,24913.459,2718.7,Submitted,4.986,,2,,,,Cluster,Intel Xeon Phi 7250 68C 1.4GHz,Intel Xeon Phi,1400,Linux,Linux,None,68,Intel Xeon Phi,PRIMERGY CX1640 M1,Fujitsu Cluster,Omnipath,Intel Omni-Path,Eastern Asia,Asia,50673,178932
23,318,,"Inspur TS10000, Xeon E5-2690v3 12C 2.6GHz/Xeon E5-2690v4, Intel Omni-Path",Qingdao National Laboratory for Marine Science and Technology,Inspur,China,2016,Research,23920,,771.3,1030.195,162,Submitted,4.761,,,,,,Cluster,Xeon E5-2690v3 12C 2.6GHz,Intel Haswell,2600,CentOS,Linux,None,12,Intel Xeon E5 (Haswell),Inspur TS10000,Inspur Cluster,Omnipath,Intel Omni-Path,Eastern Asia,Asia,50663,178855
24,204,Sequana BXI,"Bull Sequana X1000, Intel Xeon Phi 7250 68C 1.4GHz, Bull BXI 1.2",Atos,Bull,France,2017,Vendor,35360,,947.889,1584.128,212,Submitted,4.471,,,71824,,,Cluster,Intel Xeon Phi 7250 68C 1.4GHz,Intel Xeon Phi,1400,bullx SCS,Linux,None,68,Intel Xeon Phi,Bull Sequana X1000,Bull Sequana,Custom Interconnect,Bull BXI 1.2,Western Europe,Europe,50630,179038
25,96,AIGIS,"Sugon Cluster W780I, Xeon E5-2630v4 10C 2.2GHz, NVIDIA Tesla P100, Infiniband FDR",Government,Sugon,China,2017,Government,24400,22400,1307,1950.4,300,Submitted,4.357,,,24400,,,Cluster,Xeon E5-2630v4 10C 2.2GHz,Intel Broadwell,2200,CentOS,Linux,NVIDIA Tesla P100,10,Intel Xeon E5 (Broadwell),Sugon Cluster W780I,Sugon Cluster,Infiniband,Infiniband FDR,Eastern Asia,Asia,50366,179254
26,463,,"HPE SGI 8600, Xeon Gold 6148 20C 2.4GHz, Infiniband EDR",HPE,HPE,United States,2017,Vendor,11520,,590.481,884.736,141.05,Submitted,4.186,,1,5760,,,Cluster,Xeon Gold 6148 20C 2.4GHz,Intel Skylake,2400,SLES12 SP2,Linux,None,20,Xeon Gold,HPE SGI 8600,HPE SGI 8600,Infiniband,Infiniband EDR,North America,Americas,50736,179177
27,313,XStream,"Cray CS-Storm, Intel Xeon E5-2680v2  10C 2.8GHz, Infiniband FDR, Nvidia K80",Stanford Research Computing Center,Cray Inc.,United States,2015,Academic,14820,13520,781.3,1001.692,190,Submitted,4.112,,,,,,Cluster,Intel Xeon E5-2680v2  10C 2.8GHz,Intel IvyBridge,2800,Linux,Linux,NVIDIA Tesla K80,10,Intel Xeon E5 (IvyBridge),Cray CS-Storm,Cray CS-Storm,Infiniband,Infiniband FDR,North America,Americas,50575,178566
28,41,Camphor 2,"Cray XC40, Intel Xeon Phi 7250 68C 1.4GHz, Aries interconnect ","Academic Center for Computing and Media Studies (ACCMS),  Kyoto University",Cray Inc.,Japan,2016,Academic,122400,,3057.35,5483.52,748.1,Submitted,4.087,,,,,,MPP,Intel Xeon Phi 7250 68C 1.4GHz,Intel Xeon Phi,1400,Cray Linux Environment ,Linux,None,68,Intel Xeon Phi,Cray XC40,Cray XC,Custom Interconnect,Aries interconnect ,Eastern Asia,Asia,50516,178927
29,387,,"HPE SGI 8600, Xeon Gold 6154 18C 3GHz, Intel Omni-Path",HPE,HPE,United States,2017,Vendor,10368,,692.156,995.328,170.45,Submitted,4.061,,1,5184,,,Cluster,Xeon Gold 6154 18C 3GHz,Intel Skylake,3000,RHEL 7.3,Linux,None,18,Xeon Gold,HPE SGI 8600,HPE SGI 8600,Omnipath,Intel Omni-Path,North America,Americas,50736,179176
30,444,OzSTAR,"PowerEdge R740, Xeon Gold 6140 18C 2.3GHz, NVIDIA Tesla P100, Dell EMC H-Series (Omni-Path)",Swinburne University of Technology,Dell EMC,Australia,2017,Academic,17020,12880,614.5,1081,152.8,Submitted,4.022,,,,,,Cluster,Xeon Gold 6140 18C 2.3GHz,Intel Skylake,2300,CentOS,Linux,NVIDIA Tesla P100,18,Xeon Gold,PowerEdge R740,Dell PowerEdge Cluster,Omnipath,Dell EMC H-Series (Omni-Path),Australia and New Zealand,Oceania,50756,179309
31,95,Peta HPC,"PRIMERGY CX2550 M4/CX2560 M4/CX2570 M4, Xeon Gold 6148 20C 2.4GHz, Intel Omni-Path",National Center for High Performance Computing,Fujitsu,Taiwan,2017,Research,27200,,1325.15,2088.96,332,Submitted,3.991,,,,,,Cluster,Xeon Gold 6148 20C 2.4GHz,Intel Skylake,2400,RHEL 7.3,Linux,None,20,Xeon Gold,PRIMERGY CX2550 M4/CX2560 M4/CX2570 M4,Fujitsu PRIMERGY,Omnipath,Intel Omni-Path,Eastern Asia,Asia,48468,179170
32,23,Tera-1000-2-Part 1,"Bull Sequana X1000, Intel Xeon Phi 7250 68C 1.4GHz, Bull BXI 1.2",Commissariat a l'Energie Atomique (CEA),Bull,France,2017,Research,208896,,4967.22,9358.541,1248,Submitted,3.98,,,,,,Cluster,Intel Xeon Phi 7250 68C 1.4GHz,Intel Xeon Phi,1400,bullx SCS,Linux,None,68,Intel Xeon Phi,Bull Sequana X1000,Bull Sequana,Custom Interconnect,Bull BXI 1.2,Western Europe,Europe,47593,179162
33,16,MareNostrum,"Lenovo SD530, Xeon Platinum 8160 24C 2.1GHz, Intel Omni-Path",Barcelona Supercomputing Center,Lenovo,Spain,2017,Academic,153216,,6470.8,10296.115,1632,Submitted,3.965,,,153216,,,Cluster,Xeon Platinum 8160  24C 2.1GHz,Intel Skylake,2100,SUSE Linux,Linux,None,24,Xeon Platinum,ThinkSystem SD530,Lenovo ThinkSystem,Omnipath,Intel Omni-Path,Southern Europe,Europe,49748,179067
34,450,,"Inspur TS10000, Xeon E5-2650v3 10C 2.3GHz, Infiniband FDR, NVIDIA Tesla K40",Internet Company A,Inspur,China,2015,Industry,10720,8040,604.4,865.104,162,Submitted,3.731,,,,,,Cluster,Xeon E5-2650v3 10C 2.3GHz,Intel Haswell,2300,CentOS,Linux,NVIDIA Tesla K40,10,Intel Xeon E5 (Haswell),Inspur TS10000,Inspur Cluster,Infiniband,Infiniband FDR,Eastern Asia,Asia,50580,178854
35,451,,"Inspur TS10000, Xeon E5-2650v3 10C 2.3GHz, Infiniband FDR, NVIDIA Tesla K40",Internet Company A,Inspur,China,2016,Industry,10720,8040,604.4,865.104,162,Submitted,3.731,,,,,,Cluster,Xeon E5-2650v3 10C 2.3GHz,Intel Haswell,2300,CentOS,Linux,NVIDIA Tesla K40,10,Intel Xeon E5 (Haswell),Inspur TS10000,Inspur Cluster,Infiniband,Infiniband FDR,Eastern Asia,Asia,50580,178984
36,445,,"Inspur TS10000 HPC Server, Intel Xeon E5-2620v2 6C 2.1GHz, 10G Ethernet, NVIDIA Tesla K40",Internet Service (B),Inspur,China,2015,Industry,10800,9000,614.1,888.24,165,Submitted,3.722,,,,,,Cluster,Intel Xeon E5-2620v2 6C 2.1GHz,Intel IvyBridge,2100,CentOS,Linux,NVIDIA Tesla K40,6,Intel Xeon E5 (IvyBridge),Inspur TS10000 HPC Server,Inspur Cluster,10G,10G Ethernet,Eastern Asia,Asia,50330,178648
37,7,Trinity,"Cray XC40, Intel Xeon Phi 7250 68C 1.4GHz, Aries interconnect ",DOE/NNSA/LANL/SNL,Cray Inc.,United States,2017,Research,979968,,14137.3,43902.566,3843.58,Submitted,3.678,,,,,,MPP,Intel Xeon Phi 7250 68C 1.4GHz,Intel Xeon Phi,1400,Cray Linux Environment ,Linux,None,68,Intel Xeon Phi,Cray XC40,Cray XC,Custom Interconnect,Aries interconnect ,North America,Americas,50334,178610
38,471,,"Inspur TS10000, Xeon E5-2620v3 6C 2.4GHz, 40G Ethernet, NVIDIA Tesla K40",Internet Service (B),Inspur,China,2016,Industry,9792,8160,581.1,829.71,159,Submitted,3.655,,,,,,Cluster,Xeon E5-2620v3 6C 2.4GHz,Intel Haswell,2400,CentOS,Linux,NVIDIA Tesla K40,6,Intel Xeon E5 (Haswell),Inspur TS10000,Inspur Cluster,Gigabit Ethernet,40G Ethernet,Eastern Asia,Asia,50330,178986
39,459,,"Inspur TS10000, Xeon E5-2620v3 6C 2.4GHz, 40G Ethernet, NVIDIA Tesla K40",Internet Service (B),Inspur,China,2016,Industry,10224,8520,596.3,877.674,166,Submitted,3.592,,,,,,Cluster,Xeon E5-2620v3 6C 2.4GHz,Intel Haswell,2400,CentOS,Linux,NVIDIA Tesla K40,6,Intel Xeon E5 (Haswell),Inspur TS10000,Inspur Cluster,Gigabit Ethernet,40G Ethernet,Eastern Asia,Asia,50330,178857
40,8,Cori,"Cray XC40, Intel Xeon Phi 7250 68C 1.4GHz, Aries interconnect ",DOE/SC/LBNL/NERSC,Cray Inc.,United States,2016,Research,622336,,14014.7,27880.653,3939,Submitted,3.558,,,,,,MPP,Intel Xeon Phi 7250 68C 1.4GHz,Intel Xeon Phi,1400,Cray Linux Environment ,Linux,None,68,Intel Xeon Phi,Cray XC40,Cray XC,Custom Interconnect,Aries interconnect ,North America,Americas,48429,178924
41,75,Peta4,"Dell C6420, Xeon Gold 6142 16C 2.6GHz, Intel Omni-Path",University of Cambridge,Dell EMC,United Kingdom,2017,Academic,46464,,1696.6,2875,479.76,Submitted,3.536,,,,,,Cluster,Xeon Gold 6142 16C 2.6GHz,Intel Skylake,2600,Scientific Linux,Linux,None,16,Xeon Gold,Dell C6420,Dell PowerEdge Cluster,Omnipath,Intel Omni-Path,Northern Europe,Europe,49143,179305
42,33,Electra,"HPE SGI 8600, SGI ICE-X, Xeon E5-2680V4/Gold 6148 20C 2.4GHz, Infiniband EDR",NASA/Ames Research Center/NAS,HPE,United States,2017,Research,78336,,3328.59,4777.574,979.62,Submitted,3.398,,1,78336,,,Cluster,Xeon Gold 6148 20C 2.4GHz,Intel Skylake,2400,SLES12 SP2,Linux,None,20,Xeon Gold,HPE SGI 8600,HPE SGI 8600,Infiniband,Infiniband EDR,North America,Americas,48408,178966
43,86,Endeavor,"Intel Cluster, Intel Xeon Gold 6148/Xeon Phi 7250F 68C 1.4GHz, Intel Omni-Path",Intel,Intel,United States,2011,Industry,45680,,1462.97,2507.264,431,Submitted,3.394,,1,45680,,,Cluster,Intel Xeon Phi 7250F 68C 1.4GHz,Intel Xeon Phi,1400,Linux,Linux,None,68,Intel Xeon Phi,Intel Cluster,Intel Cluster,Omnipath,Intel Omni-Path,North America,Americas,49821,176908
44,302,Brown,"PowerEdge R640, Xeon Gold 6126 12C 2.6GHz, Infiniband EDR",Purdue University,Dell EMC,United States,2017,Academic,12960,,793.245,1078.272,240,Submitted,3.305,,1,12960,,,Cluster,Xeon Gold 6126 12C 2.6GHz,Intel Skylake,2600,Linux,Linux,None,12,Xeon Gold,PowerEdge R640,Dell PowerEdge Cluster,Infiniband,Infiniband EDR,North America,Americas,48657,179169
45,495,DLSystem,"Sugon W580-G20, Xeon E5-2640v3 8C 2.6GHz, 10G Ethernet, NVIDIA Tesla K80",Trading Company,Sugon,China,2016,Industry,13440,11648,551.1,912.307,168,Submitted,3.28,,,,,,Cluster,Xeon E5-2640v3 8C 2.6GHz,Intel Haswell,2600,CentOS,Linux,NVIDIA Tesla K80,8,Intel Xeon E5 (Haswell),Sugon W580-G20,Sugon Cluster,10G,10G Ethernet,Eastern Asia,Asia,50618,178846
46,70,Molecular Simulator,"NEC LX Cluster, Xeon Gold 6148/6154, Intel Omni-Path",Institute for Molecular Science,NEC,Japan,2017,Research,38552,,1785.62,3072.768,544.48,Submitted,3.279,,,,,,Cluster,Xeon Gold 6148 20C 2.4GHz,Intel Skylake,2400,CentOS,Linux,None,20,Xeon Gold,NEC LX Cluster,NEC Cluster,Omnipath,Intel Omni-Path,Eastern Asia,Asia,48473,179173
47,358,,"Inspur TS10000 HPC Server, Intel Xeon E5-2650v2  8C 2.6GHz, 10G Ethernet, NVIDIA Tesla K40",Internet Service A,Inspur,China,2015,Industry,15640,10200,730.1,1085.552,225,Submitted,3.245,,,,,,Cluster,Intel Xeon E5-2650v2  8C 2.6GHz,Intel IvyBridge,2600,CentOS,Linux,NVIDIA Tesla K40,8,Intel Xeon E5 (IvyBridge),Inspur TS10000 HPC Server,Inspur Cluster,10G,10G Ethernet,Eastern Asia,Asia,50596,178656
48,145,PreEarthSim,"Sugon TC4600, Xeon Gold 6132 14C 2.6GHz, Intel Omni-Path","Institute of Atmospheric Physics, Chinese Academy of Sciences",Sugon,China,2017,Research,19264,,1075,1602.7648,344,Submitted,3.125,,,19264,,,Cluster,Xeon Gold 6132 14C 2.6GHz,Intel Skylake,2600,CentOS,Linux,None,14,Xeon Gold,Sugon TC4600,Sugon Cluster,Omnipath,Intel Omni-Path,Eastern Asia,Asia,50740,179249
49,143,Falcon,"SGI ICE X, Xeon E5-2695v4 18C 2.1GHz, Infiniband FDR",Idaho National Laboratory,HPE,United States,2016,Research,34884,,1087.58,1172.102,354,Submitted,3.072,,,34884,,,Cluster,Xeon E5-2695v4 18C 2.1GHz,Intel Broadwell,2100,SUSE Linux Enterprise Server 11,Linux,None,18,Intel Xeon E5 (Broadwell),SGI ICE X,SGI ICE,Infiniband,Infiniband FDR,North America,Americas,47650,179041
50,315,Sekirei-ACC,"SGI ICE XA, Xeon E5-2680v3 12C 2.5GHz, Infiniband FDR, Nvidia K40",University of Tokyo/Institute for Solid State Physics,HPE,Japan,2015,Academic,15552,8640,777.4,1100.16,255.3,Submitted,3.045,,,,,,Cluster,Xeon E5-2680v3 12C 2.5GHz,Intel Haswell,2500,SUSE Linux Enterprise Server 11,Linux,NVIDIA Tesla K40,12,Intel Xeon E5 (Haswell),SGI ICE XA,SGI ICE,Infiniband,Infiniband FDR,Eastern Asia,Asia,49208,178527
51,65,Mogon II,"NEC Cluster, Xeon Gold 6130 16C 2.1GHz, MEGWARE MiriQuid Xeon E5-2630v4, Intel Omni-Path",Universitaet Mainz,NEC/MEGWARE,Germany,2017,Academic,49432,,1967.81,2800.86998,657,Submitted,2.995,,2,49432,,,Cluster,Xeon Gold 6130 16C 2.1GHz,Intel Skylake,2100,CentOS,Linux,None,16,Xeon Gold,NEC Cluster,NEC Cluster,Omnipath,Intel Omni-Path,Western Europe,Europe,49102,178930
52,56,Centennial,"SGI ICE XA, Xeon E5-2698v4 20C 2.2GHz, Infiniband EDR",US Army Research Laboratory (ARL),HPE,United States,2017,Research,73920,,2443.7,2601.984,835,Submitted,2.927,,,,,,Cluster,Xeon E5-2698v4 20C 2.2GHz,Intel Broadwell,2200,RHEL 7.2,Linux,None,20,Intel Xeon E5 (Broadwell),SGI ICE XA,SGI ICE,Infiniband,Infiniband EDR,North America,Americas,49039,179105
53,84,scafellpike,"Bull Sequana X1000, Intel Xeon Phi 7210 64C 1.3GHz/Xeon Gold 6142, Mellanox EDR",Science and Technology Facilities Council,Bull,United Kingdom,2017,Research,80640,,1531.6,4329.728,526,Submitted,2.912,,,,,,Cluster,Intel Xeon Phi 7210 64C 1.3GHz,Intel Xeon Phi,1300,bullx SCS,Linux,None,64,Intel Xeon Phi,Bull Sequana X1000,Bull Sequana,Infiniband,Infiniband EDR,Northern Europe,Europe,50732,179163
54,193,,"Huawei X6800 V3, Xeon E5-2683 v4  16C 2.1GHz, Infiniband EDR, NVIDIA Tesla P100",Energy Company,Huawei,China,2017,Industry,34816,14336,974,1906.688,343.64,Submitted,2.834,,,937984,,,Cluster,Xeon E5-2683 v4  16C 2.1GHz,Intel Broadwell,2100,CentOS,Linux,NVIDIA Tesla P100,16,Intel Xeon E5 (Broadwell),Huawei X6800 V3,Huawei Cluster,Infiniband,Infiniband EDR,Eastern Asia,Asia,50417,179052
55,29,JURECA,"T-Platforms V-Class/Dell C6320P, E5-2680v3/Phi 7250-F, EDR/Intel Omni-Path/ParTec ParaStation, Tesla K80/K40",Forschungszentrum Juelich (FZJ),"T-Platforms, Intel, Dell",Germany,2015,Research,155150,4110,3782.57,6563.84,1345.28,Submitted,2.812,,1,151040,,,Cluster,Xeon E5-2680v3 12C 2.5GHz,Intel Haswell,2500,CentOS,Linux,NVIDIA Tesla K80,12,Intel Xeon E5 (Haswell),T-Platforms V-Class Cluster,T-Platforms Cluster,Infiniband,Infiniband EDR,Western Europe,Europe,47871,178718
56,24,Cheyenne,"SGI ICE XA, Xeon E5-2697v4 18C 2.3GHz, Infiniband EDR",National Center for Atmospheric Research (NCAR),HPE,United States,2016,Research,144900,,4788.19,5332.32,1727,Submitted,2.773,,,,,,Cluster,Xeon E5-2697v4 18C 2.3GHz,Intel Broadwell,2300,SUSE Linux Enterprise Server 12 SP1,Linux,None,18,Intel Xeon E5 (Broadwell),SGI ICE XA,SGI ICE,Infiniband,Infiniband EDR,North America,Americas,48418,178965
57,90,Piz Daint Multicore,"Cray XC40, Xeon E5-2695v4 18C 2.1GHz, Aries interconnect ",Swiss National Supercomputing Centre (CSCS),Cray Inc.,Switzerland,2016,Research,44928,,1410.73,1509.581,519,Submitted,2.718,,,,,,MPP,Xeon E5-2695v4 18C 2.1GHz,Intel Broadwell,2100,Cray Linux Environment ,Linux,None,18,Intel Xeon E5 (Broadwell),Cray XC40,Cray XC,Custom Interconnect,Aries interconnect ,Western Europe,Europe,50422,178451
58,42,Mistral,"bullx DLC 720, Xeon E5-2680v3 12C 2.5GHz/E5-2695V4 18C  2.1Ghz, Infiniband FDR",DKRZ - Deutsches Klimarechenzentrum,Bull,Germany,2015,Research,99072,,3010.68,3962.88,1116,Submitted,2.698,,,,,,Cluster,Xeon E5-2680v3 12C 2.5GHz,Intel Haswell,2500,Bullx Linux,Linux,None,12,Intel Xeon E5 (Haswell),bullx DLC 720,Bull Bullx,Infiniband,Infiniband FDR,Western Europe,Europe,47642,178567
59,376,,"iDataPlex DX360M4, Intel Xeon E5-2680v2  10C 2.800GHz, Infiniband, NVIDIA K20x",Max-Planck-Gesellschaft MPI/IPP,Lenovo/IBM,Germany,2013,Research,15840,9240,709.7,1013.1,269.94,Submitted,2.629,,,,,,Cluster,Intel Xeon E5-2680v2  10C 2.8GHz,Intel IvyBridge,2800,Linux,Linux,NVIDIA Tesla K20x,10,Intel Xeon E5 (IvyBridge),iDataPlex DX360M4,IBM iDataPlex,Infiniband,Infiniband,Western Europe,Europe,48331,178199
60,435,HPCC,"Cluster Platform SL250s Gen8/Lenovo nx360M5 , Xeon E5-2665 8C 2.4GHz, Infiniband FDR, Nvidia K20m/K40m",University of Southern California,HPE,United States,2015,Academic,13440,8650,621.5,890.78,237,Submitted,2.622,,,,,,Cluster,Xeon E5-2665 8C 2.4GHz,Intel SandyBridge,2400,Linux,Linux,NVIDIA Tesla K20m,8,Intel Xeon E5 (SandyBridge),Cluster Platform SL250s Gen8,HP Cluster Platform 3000SL,Infiniband,Infiniband FDR,North America,Americas,49201,178073
61,61,Prolix2,"bullx DLC 720, Xeon E5-2698v4 20C 2.2GHz, Infiniband FDR",Meteo France,Bull,France,2014,Research,72000,,2167.99,2534.4,830.4,Submitted,2.611,,,,,,Cluster,Xeon E5-2698v4 20C 2.2GHz,Intel Broadwell,2200,bullx SCS,Linux,None,20,Intel Xeon E5 (Broadwell),bullx DLC 720,Bull Bullx,Infiniband,Infiniband FDR,Western Europe,Europe,48356,178429
